{
  "$schema": "https://json-schema.org/draft/2020-12/schema",
  "title": "wall-autotile/v1 (4-neighbor, 16 patterns)",
  "type": "object",
  "required": ["format", "version", "id", "themes", "image", "tileSize", "rise", "width", "height", "neighbors", "bitOrder", "tiles"],
  "properties": {
    "format": {"const": "wall-autotile"},
    "version": {"const": 1},
    "id": {"type": "string", "minLength": 1},
    "themes": {"type": "array", "minItems": 1, "items": {"type": "string", "minLength": 1}},
    "image": {"type": "string", "minLength": 1},
    "tileSize": {"const": 32},
    "rise": {"type": "number", "exclusiveMinimum": 0, "maximum": 1},
    "width": {"type": "integer", "minimum": 32},
    "height": {"type": "integer", "minimum": 32},
    "neighbors": {"const": 4},
    "bitOrder": {"const": ["north", "east", "south", "west"]},
    "tiles": {
      "type": "object",
      "required": ["0", "1", "2", "3", "4", "5", "6", "7", "8", "9", "10", "11", "12", "13", "14", "15"],
      "propertyNames": {"pattern": "^(?:[0-9]|1[0-5])$"},
      "additionalProperties": {"type": "array", "minItems": 1, "items": {"type": "array", "minItems": 4, "maxItems": 4, "items": {"type": "integer", "minimum": 0}}}
    }
  }
}
